{"$schema":"https://json-schema.org/draft/2020-12/schema","$id":"https://neuroai-workbench.example/schemas/entity-alias-1.0.json","type":"object","required":["alias_id","entity_id","alias_text","alias_kind","status","registered_at","boundary"],"additionalProperties":false,"properties":{"alias_id":{"type":"string","minLength":1},"entity_id":{"type":"string","minLength":1},"alias_text":{"type":"string","minLength":1},"alias_kind":{"enum":["LEGAL_NAME","TRADE_NAME","HISTORICAL_NAME","ABBREVIATION","NORMALIZED_MENTION"]},"status":{"enum":["ACTIVE","SUPERSEDED","WITHDRAWN"]},"registered_at":{"type":"string","minLength":1},"jurisdiction":{"type":["string","null"]},"evidence_ref":{"type":["string","null"]},"effective_from":{"type":["string","null"]},"effective_to":{"type":["string","null"]},"predecessor_alias_id":{"type":["string","null"]},"boundary":{"type":"string","minLength":1}}}
